{
  "schema": "atelier-authoring-action-intent@v1",
  "id": "sample:intent:annotation-001",
  "projectionId": "sample:projection:review",
  "tenantRef": "sample-studio",
  "subjectRef": "sample:document:field-notes",
  "kind": "review.record-annotation",
  "status": "proposed",
  "requestedAt": "2026-01-15T12:00:00Z",
  "authority": {
    "decision": "consumer-adapter",
    "publicationMutation": false,
    "editorialGateMutation": false,
    "runtimeMutation": false
  },
  "ext": {
    "sample.authoring": {
      "annotationRef": "sample:annotation:001"
    }
  }
}
